{
  "manifest_version": "phase7.0",
  "manifest_type": "ai_learning_generation_request",
  "phase": "7.0",
  "artifact_type": "ai_learning_generation_request",
  "status": "ai_learning_generation_request_created",
  "created_for_phase": "7.0",
  "created_at": "2026-06-04T00:00:00Z",
  "request_status": "requested",
  "request_mode": "request_only",
  "batch_id": "phase6_1_batch_001",
  "upstream_phase": "6.22",
  "upstream_manifest": "phase6_22_formal_run_review_and_closure_report.json",
  "upstream_artifact_type": "formal_run_review_and_closure_report",
  "upstream_closure_status": "closed",
  "upstream_closure_result": "pass",
  "crawler_allowed": false,
  "renderer_allowed": false,
  "recovery_allowed": false,
  "web_requests_allowed": false,
  "source_layer_modification_allowed": false,
  "ai_learning_content_generation_allowed": false,
  "ai_learning_request_creation_allowed": true,
  "phase7_1_entry_allowed": false,
  "requested_future_outputs": [
    "learning_objectives",
    "knowledge_units",
    "exam_oriented_explanations",
    "practice_questions",
    "answer_rationales",
    "misconception_warnings",
    "review_checklist",
    "source_traceability_map"
  ],
  "actual_generated_outputs": [],
  "scope": {
    "allowed_source_basis": "closed_pass_phase6_1_batch_001_only",
    "unapproved_sources_allowed": false,
    "external_sources_allowed": false,
    "source_expansion_allowed": false
  },
  "risk": {
    "risk_level": "low",
    "risk_reason": "Phase 7.0 creates only a generation request artifact and does not generate learning content or mutate source-layer artifacts."
  },
  "closure": {
    "phase7_0_status": "complete",
    "phase7_0_result": "pass"
  },
  "next_phase_recommendation": {
    "next_recommended_phase": "phase7.1_ai_learning_generation_execution",
    "phase7_1_entry_allowed": false,
    "phase7_1_entry_requires_approval": true,
    "notes": "Phase 7.1 is not authorized by this artifact alone. A separate approval gate must be created and approved before Phase 7.1 entry is permitted."
  },
  "rollback_condition": {
    "phase7_0_rollback_needed": false,
    "reason": "Request-only phase; no content was generated or mutated."
  },
  "audit_condition": {
    "upstream_phase_chain_complete": true,
    "upstream_closure_status": "closed",
    "upstream_closure_result": "pass",
    "request_mode": "request_only",
    "actual_generated_outputs_empty": true,
    "validation_commands": [
      "pnpm typecheck",
      "pnpm verify",
      "pnpm validate:formal-run-review-and-closure-report",
      "pnpm validate:ai-learning-generation-request"
    ],
    "commit_scope": "Phase 7.0 request artifact, schema, types, validator, package.json script, and verify-structure update only"
  },
  "validation_expectations": {
    "schema_validation": "must_pass",
    "invariant_checks": "must_pass",
    "phase_must_be": "7.0",
    "artifact_type_must_be": "ai_learning_generation_request",
    "request_mode_must_be": "request_only",
    "batch_id_must_be": "phase6_1_batch_001",
    "upstream_phase_must_be": "6.22",
    "upstream_closure_status_must_be": "closed",
    "upstream_closure_result_must_be": "pass",
    "ai_learning_content_generation_allowed_must_be": false,
    "ai_learning_request_creation_allowed_must_be": true,
    "phase7_1_entry_allowed_must_be": false,
    "actual_generated_outputs_must_be_empty": true,
    "requested_future_outputs_count_must_be": 8,
    "risk_level_must_be": "low",
    "closure_status_must_be": "complete",
    "closure_result_must_be": "pass"
  }
}
